{
  "schema_version": "1.1.0",
  "rule_id": "cn-mainland-regulatory-pulse",
  "version": "1.1.0",
  "name": "Mainland China Regulatory Pulse",
  "bing": {
    "instance_name": "cn-mainland-financial-regulators-test",
    "allowed_hosts": [
      "www.nfra.gov.cn",
      "www.pbc.gov.cn",
      "www.gov.cn",
      "www.safe.gov.cn"
    ]
  },
  "search": {
    "default_topic": "Mainland China insurance and financial-services regulation and supervision",
    "default_days": 30,
    "results_per_query": 5,
    "queries": [
      {
        "query_id": "en",
        "language": "English",
        "market": "en-CN",
        "set_lang": "en",
        "template": "({topic}) (consultation OR circular OR guideline OR enforcement OR implementation OR notice OR regulation) after:{date_from} before:{date_to}"
      },
      {
        "query_id": "zh-hans",
        "language": "Simplified Chinese",
        "market": "zh-CN",
        "set_lang": "zh-Hans",
        "template": "({topic}) (征求意见 OR 通知 OR 办法 OR 规定 OR 监管 OR 处罚 OR 实施 OR 新闻发布) {date_from} {date_to}"
      }
    ],
    "inclusion_rules": [
      "Include official publications about insurance or financial regulation, supervision, consultations, enforcement, implementation, customer protection, distribution, capital, governance, reporting, cross-border finance, or digital operations.",
      "Prefer newly published or materially updated items within the requested window.",
      "Return a concise grounded note for each candidate and preserve native source citations."
    ],
    "exclusion_rules": [
      "Exclude event promotion, training notices, awards, vacancies, and routine republication without a substantive update.",
      "Do not claim that no event occurred merely because the search returned no result."
    ]
  },
  "summarization": {
    "output_language": "English",
    "audience": "AIA Group CEO",
    "max_items": 5,
    "ranking_rules": [
      "Rank direct implications for insurers, customers, distribution, capital, governance, reporting, cross-border operations, or operating models highest.",
      "Prefer binding or time-sensitive developments over general commentary.",
      "Prefer newer publications when relevance is otherwise similar."
    ],
    "attention_rules": [
      "Assess regulatory strength, direct relevance to AIA, and urgency on an internal 0-2 scale; map totals of 5-6 to high, 3-4 to medium, and 0-2 to low without displaying numeric scores.",
      "Use high only when the grounded source note establishes a final rule or enforcement action with direct AIA relevance; otherwise use medium or low.",
      "Use medium for consultations, guidance, or materially relevant developments that require assessment but do not establish an immediate obligation.",
      "Use low for general informational updates without an identified near-term action.",
      "If legal status, urgency, or applicability to AIA is unclear, do not use high."
    ],
    "writing_rules": [
      "Use plain executive English and explain the development before its possible relevance to AIA.",
      "Keep factual source notes separate from conditional implications for AIA.",
      "Do not invent facts, dates, quantified impacts, source links, or applicability to an AIA entity.",
      "Use cautious wording when the grounded source note does not establish legal status or applicability."
    ]
  }
}
